{
  "$schema": "http://json-schema.org/draft-07/schema#",
  "$id": "https://chp.dev/schemas/law.json",
  "title": "CHP Law",
  "description": "Schema for law.json — each law is a directory under docs/chp/laws/<name>/ containing law.json, verify.sh, and guidance.md",
  "type": "object",
  "required": ["name", "severity", "hooks", "enabled"],
  "properties": {
    "name": {
      "type": "string",
      "pattern": "^[a-z][a-z0-9-]{2,31}$",
      "description": "Law identifier. Must match the directory name."
    },
    "severity": {
      "type": "string",
      "enum": ["error", "warn", "info"],
      "description": "Default severity level for the law."
    },
    "hooks": {
      "type": "array",
      "items": {
        "type": "string",
        "enum": [
          "pre-commit",
          "pre-push",
          "post-commit",
          "commit-msg",
          "pre-tool",
          "post-tool",
          "pre-write",
          "post-response"
        ]
      },
      "minItems": 1,
      "description": "Which hook events this law attaches to."
    },
    "enabled": {
      "type": "boolean",
      "default": true,
      "description": "Whether the law is actively enforced."
    },
    "intent": {
      "type": "string",
      "minLength": 10,
      "description": "Human-readable description of what the law enforces and why."
    },
    "checks": {
      "type": "array",
      "default": [],
      "items": {
        "type": "object",
        "required": ["id", "type", "config", "severity", "message"],
        "properties": {
          "id": {
            "type": "string",
            "pattern": "^[a-z][a-z0-9_-]{1,63}$",
            "description": "Unique identifier for this check within the law."
          },
          "type": {
            "type": "string",
            "enum": ["pattern", "agent", "structural", "metric"],
            "description": "Checker type. Must have a matching core/checkers/<type>.sh."
          },
          "config": {
            "type": "object",
            "description": "Type-specific configuration. Pattern checks need a 'pattern' string."
          },
          "severity": {
            "type": "string",
            "enum": ["block", "warn", "log"],
            "description": "What happens when this check fails."
          },
          "message": {
            "type": "string",
            "minLength": 5,
            "description": "Human-readable guidance shown on failure."
          }
        }
      }
    },
    "created": {
      "type": "string",
      "format": "date-time",
      "description": "ISO 8601 timestamp of when the law was created."
    },
    "failures": {
      "type": "integer",
      "minimum": 0,
      "default": 0,
      "description": "Runtime counter — number of times this law has failed."
    },
    "tightening_level": {
      "type": "integer",
      "minimum": 0,
      "default": 0,
      "description": "Runtime counter — how many times guidance has been auto-tightened."
    }
  }
}
