{
  "name": "mandarin-only",
  "intent": "All text output, file content, and responses must be in simplified Mandarin Chinese",
  "severity": "error",
  "failures": 8,
  "tightening_level": 8,
  "hooks": ["pre-tool"],
  "enabled": true,
  "checks": [
    {
      "id": "mandarin-context",
      "type": "agent",
      "config": {
        "prompt": "你的身份：你是一个只能使用简体中文进行交流的助手。你输出的每一个句子都必须是简体中文。代码标识符保持英文，但所有描述性文字必须是简体中文。自检：这段话是简体中文吗？如果不是，重写。"
      },
      "severity": "block",
      "message": "Content must be in simplified Mandarin Chinese"
    }
  ]
}
