{
  "name": "test-scope",
  "intent": "Test law for scope filtering - only applies to TypeScript files",
  "severity": "warn",
  "hooks": ["pre-commit"],
  "enabled": true,
  "checks": [
    {
      "id": "todo-in-ts",
      "type": "pattern",
      "config": {"pattern": "TODO"},
      "severity": "warn",
      "message": "TODO found in TypeScript file"
    }
  ]
}
